#;Тема;Назначена;Модуль;Категория ошибки;Трудозатраты
80739;Маркировка не каждый раз видна (Спецификация);ADP;Констр. объекты;old;4
80494;[int] Не отображается значение атрибута-ссылки в гриде ;ADP;Бизнес-объекты;old;8,8
80420;[int] Скрипт, который проверяет наличие инициализирующей записи в календаре и добавляет её;ADP;Базовые справочники;regressive;0,95
80303;При импорте работника выдает ошибку.;ADP;Базовые справочники;modification;2,5
80106;[int] MFC exception при открытии карточки свойств объекта системы;ADP;Объекты системы;new;1,7
80498;При взятие на изменение БО , с помощью чекбокса, программа не отображает что БО взят на изменение /снят с изменений;AVI;Констр. объекты;new;6
80368;"Некорректно работает фильтр поиска БО в задаче ""Сканированные файлы""";AVI;Констр. объекты;new;10,5
80313;[int] Убрать возможность добавлять строки содержимого через форму ;AVI;Бизнес-объекты;modification;2,5
80141;[int] PostgreSQL: не удается объединить предприятия;AVI;Базовые справочники;postgre;16,6
79883;[int] Ошибка при вызове команды Показать в списке из содержимого спецификации;AVI;Констр. объекты;not available;1
80422;Некорректное отображение остатка в цеховой номенклатуре;AVS;Учет в производстве;old;14,85
79050;Не работает опция настройки алгоритма работы МЛ;AVS;Учет в производстве;modification;1
79988;[int] Некорректное добавление элементов в план-задание от производственных программ;AVS_SAV_CHIG_SSB_REI_ASA;Планирование цеховое;not available;1,15
79355;[int] PostgreSQL: Ошибка PostgreSQL [42846] - при формировании состава КВ;AVS_SAV_CHIG_SSB_REI_ASA;Складской учет;not available;0,55
79802;Блокировки Lock: tuple, Lock: transactionid, LWLock: BufferMapping при выполнении вставок и апдейтов в таблице soc_stages, soc_sheets;BEA;FOP/FOS;postgre;25
80468;Потоки работ 1.0. Некорректное отображение команд для КР из совмещенной формы ;BIV;Потоки работ;new;3,1
80036;"Потоки работ 2.0. Некорректное поведение присоединенной формы ""Список работ над объектом (ПР 2.0)""";BIV;Потоки работ;new;17,1
79976;"Необходимо увеличить размер поля ""ADDPOS"" во времененной таблице ""TINCITEMDATA_STORAGE_TMP"" с 5 символов до 8 при раскрытии производственного состава Ед.Общ.Спец.";BIV;Констр. объекты;old;1
80735;Наряды.Исправить фильтрацию по цехам\участкам;CHIG;Учет в производстве;new;3,8
80730;При генерации МЛ от заказа для пустых не выполняются бо-дейтсвия по установлению процента выполнения;CHIG;Учет в производстве;new;2,5
80588;Падение системы при выборе нескольких экземпляров ПЗ;CHIG;Планирование заводское;new;3
80536;Наряды. Исправить некорректные данные;CHIG;Учет в производстве;new;9,5
80321;[int] Не загружаются МЛ без состава;CHIG;Учет в производстве;new;2,05
80256;"Ошибка заполнения реквизита ""№ спецификации"" в карточке св-в Поставка ";CHIG;Нормативные затраты;new;4,8
80128;Неправильное вычисление OrderNum при переносе активности;CHIG;FOP/FOS;support;2,7
80127;Ошибка выгрузки ед. изм. атрибутов вкладки времени при выгрузке в 1С;CHIG;Разное;support;2,15
80012;[int] Ошибка Oracle ORA-00932 при открытии списка МЛ;CHIG;Учет в производстве;new;0,3
79879;Ошибка формирования xml для выгрузки в 1С для данных о разряде исполнителя ТП;CHIG;Разное;not available;2
79811;Ошибка при выборе участков в справочнике повышающих коэффициентов;CHIG;Учет в производстве;new;4
80762;Дублируется зависимость ТП от экземпляра в редакторе ТП;DMY;Техпроцессы;regressive;1,3
80760;Ошибки отображения данных в ВТМ документ;DMY;Маршруты;regressive;3,9
80731;Отсутствует состояние в прогрессбаре при формировании отчета по ТП от сохраненного состава заказа;DMY;Техпроцессы;old;7,2
80729;Падение приложения при формировании отчета Техпроцессы оснастки вызываемого от сохраненного заказа в производство;DMY;Техпроцессы;old;2
80725;Ошибка при переводе с COM - OmTPPUI.dll;DMY;ТПП;new;1,25
80679;"Некорректное формирование иерархического представления ВТМ для ДСЕ, входящих в узел с признаком ""Не учитывать в составе""";DMY;Маршруты;old;2,7
80678; Ошибка копирования исполнителя перехода, при добавлении перехода из справочника в ТП;DMY;Техпроцессы;old;1,9
80677;В редакторе ТП исчезают пассивные операции блока замен;DMY;Техпроцессы;new;1,4
80637;[int] Падение при копировании оснастки между операциями;DMY;Техпроцессы;old;1,9
80627;[int] При копировании КЭ не происходит копирование вспомогательных норм;DMY;Мат. нормативы;support;1,1
80589;Ошибка перенумерации при добавлении операции в середину ТП;DMY;Техпроцессы;old;3,15
80570;[code64] Ошибка верификации 086 ТП ;DMY;Техпроцессы;old;5,55
80566;[int] COmpTechprocToKobjManagerImpl (WARN): загружать все связки запрещено!;DMY;Техпроцессы;old;4
80563;Ошибка кодировки при выводе данных об операции в протоколе замены оснастки ТП;DMY;Техпроцессы;old;2
80558;Падение при переключении активности ТП;DMY;Техпроцессы;regressive;1,75
80486;Ошибка установки цеха при создании ревизии ТП;DMY;Техпроцессы;old;5,75
80467;[int] Ошибка Oracle ORA-01854 при создании маршрута;DMY;Маршруты;support;0,5
80408;[int] Падение приложение при открытии закладки Детали (таб Исполнители) для перехода ТТП;DMY;Техпроцессы;new;0,35
80390;[int] Не выводится норма расхода вспом. мат-ла при просмотре печати типового ТП;DMY;Техпроцессы;old;4,5
80381;Ошибка перенумерации операций при удалении;DMY;Техпроцессы;old;1
80346;[int] Ошибка расчета стоимости операции;DMY;Техпроцессы;new;0,6
80326;"Не работает открытие редактора изменений для атрибута с типом Объект-текст в гриде отчета ""Список ТП""";DMY;Техпроцессы;new;2,35
80318;После создания ревизии ТП не копируются связи КЭ с операциям ГТП;DMY;Техпроцессы;new;4,45
80317;"Не корректная работа отчета от ТП ""Данные техпроцесса по операциям""";DMY;Техпроцессы;old;4,4
80315;[int] Не отображаются исполнители на операции ТП;DMY;Техпроцессы;new;2,15
80248;Порядок сортировки операций для документации ТП не соответствует порядку сортировки операций в дереве редактора;DMY;Техпроцессы;old;6,3
80209;v.2 Падение приложения при копировании маршрута через ВТМ документ (только у заказчика!);DMY;Маршруты;old;4,3
80206;Не корректно работает верификация [211] Проверка наличия у операции техпроцесса цеха;DMY;Техпроцессы;modification;3,55
80183;"Падение Омеги при вызове команды к.м. ""перенумеровать операции с текущей.."" в редакторе ТП ";DMY;Техпроцессы;new;4,1
80168;Оптимизировать время открытия закладки Исполнители редактора ТП;DMY;Техпроцессы;old;11,85
80157;При указании бригады  ошибка связи с участком  в трудовых нормативах ;DMY;Трудовые нормативы;old;3,25
80151;При удалении материала на переходе, удаленный материал остаются видимыми в дереве ТП;DMY;Техпроцессы;old;1,8
80060;[int] PostgreSQL: Ошибка PostgreSQL [42883] - при удалении файла с операции ТП;DMY;Разное;postgre;3,1
80046;Ошибка при сохранении Начального текста, Комментария, Конечного текста на операцию ТП;DMY;Техпроцессы;old;9,35
80041;144 провайдер. Задвоение обозначения ревизии КЭ при печати;DMY;Техпроцессы;old;2
80033;[int] Не отображается закладка в редакторе ТП;DMY;Техпроцессы;support;0,8
80029;[int] Ошибка при попытке открытия контрольной карты от контролируемого параметра ТП;DMY;Техпроцессы;new;1,6
80021;Ошибка создания маршрута при наследовании маршрутов по входимости в ведомость замен;DMY;Маршруты;regressive;2,45
80011;"Не работает верификация ""[086] Проверка наличия оборудования у операции"" у ТП";DMY;Техпроцессы;old;2,2
79962;[code64] Отсутствует в выборке вид работ в справочнике Профессии и операции;DMY;Трудовые нормативы;support;2,5
79904;Не создается ревизия ТП из-за одинаковых КЭ с одинаковыми позициями у КК, хотя таких позиций нет;DMY;Техпроцессы;old;4,5
79874;Недопустимый аргумент при переходе между вкладками ТП после добавления оснастки и материала на переход;DMY;Техпроцессы;old;3,6
79807;[int] В дереве не отображается начальный текст, добавленный на операцию;DMY;Техпроцессы;new;0,6
79695;[int] PostgreSQL: не рассчитывается норма расхода материала на ГТП;DMY;Техпроцессы;postgre;2,95
79435;Ошибка вывода данных о конечном пункте в ВТМ для дсе, входящих в у зел с признаком неучитывать в составе;DMY;Маршруты;zakazchik;5,7
80779;Перенумерация переходов при изменении номера перехода;DMY_GIY_BEA_MNS_MSV;Техпроцессы;modification;0,25
80440;Не создается начальный текст на операции ТП;DMY_GIY_BEA_MNS_MSV;Техпроцессы;not available;0,5
80114;[int] Падение омеги при создании технологического материала;DMY_GIY_BEA_MNS_MSV;Мат. нормативы;patch;0,15
80050;[int] PostgreSQL: Невозможно создать календарь по умолчанию при расчете проекта;GIY;Планирование проектное;support;9,35
80577;"Вопрос по расчету трудоемкости в ""Сводная трудоемкость по номерам комплектов""";KAD;Планирование заводское;new;4
80283;При формировании производственного расписания от Единичного ТП задвоились операции от 1 ТП;KAD;Планирование заводское;support;1,5
80010;"Для модели планирования ""РузХИММАШ"" пропала возможность редактировать расписание партий.";KAD;Планирование заводское;support;0,5
79933;Не обновляется UI при изменении планового количества у элемента плана.;KAD;Планирование заводское;new;8
80500;"Калькуляция. Некорректно отрабатывает подсуммирование в содержимом при выходе из режима ""Отображать на ед.""";KRA;Нормативные затраты;new;9,6
80479;"Ошибка формирования данных по API: ""orderProtfolio/orderProtfolioComposition.loadSave"" при использовании параметра фильтра ""LoadBranchesWithControlledItems"": true";KRA;Планирование заводское;new;3,5
80474;"Цены. Недоступны к редактированию реквизиты группбокса ""Расходы"" и ""Примечание""";KRA;Цены;old;1,2
80211;"Ошибка вывода переменной ""Коэффициенты"" в провайдере печати 225";KRA;Нормативные затраты;new;2,5
80163;[int] Сравнение НЗ. Падение Омеги при сравнении НЗ в старой редакции;KRA;Нормативные затраты;new;5,2
80147;[int] Не перетягиваются итоговые строки НЗ в окно Сравнения нормативных затрат на базе МТЗ Daily;KRA;Нормативные затраты;old;1
80026;Цеховая калькуляция. Некорректно тянутся элементы из НЗ в калькуляцию;KRA;Нормативные затраты;old;1
80001;Справочник разделов плана. Блокировка выше- и нижележащих уровней;KRA;Планирование заводское;old;1,3
79893;Расчет ресурсов плана/Трудоемкость по составу - не сохраняется выбранные настройки Ручное задание применения.;KRA;Планирование заводское;old;0,5
79853;"Экспорт в Excel динамических гридов. Не наследуются форматы таблицы ""по умолчанию"" (только после установки польз. настроек)";KRA;Разное;old;8,8
79800;[int] Проблема с провайдером, вызывается не та печатная форма;KRA;Нормативные затраты;new;2,4
80372;Ошибка удаления семейства в КСО ЗЧМ;MNE;FOP/FOS;new;2,2
80291;"При удалении семейства из загрузки выходит ошибка ""Bad optional access""";MNE;FOP/FOS;new;4,4
80282;[int] Ошибка некорректного запроса в БД при передаче в другую бригаду;MNE;FOP/FOS;new;1,3
80218;[int] PostgreSQL: Ошибка PostgreSQL [42883] - при поиске профессии по коду в браузере;MNE;Трудовые нормативы;new;4,4
80131;У КСО ЗЛ/ЗЧМ не меняется update_user ;MNE;FOP/FOS;new;14,1
80088;[int] Ошибка MFC exeption: Обязательный ресурс недоступен и падение системы при открытии редактора ТН;MNE;Трудовые нормативы;new;4,4
80083;[int] PostgreSQL: Ошибка PostgreSQL [42883] - при изменении норм ТН;MNE;Трудовые нормативы;postgre;2,05
80071;[int] PostgreSQL: Ошибка PostgreSQL [P0002] - при создании пооперационной расценки;MNE;Трудовые нормативы;postgre;1,15
80436;[int] Ошибка ПГ при добавлении  материала в операцию классификатора технологических процессов ;MNS;Техпроцессы;postgre;3
80153;[CODE64] Ошибка ORA-04091 при удалении операции ТП;MNS;Техпроцессы;new;4,3
80451;После обновлений слетают настройки сортировки столбцов ;MPS;Разное;not available;0
80040;Не корректно работает фильтр выбора заголовка колонок в отчете;MPS;Объекты системы;new;13,7
79652;[int] PostgreSQL: ошибка инициализации механизма редактирования при открытии графика изготовления ПП;MPS;Планирование заводское;regressive;8,15
79607;При формировании отчета по схеме заголовков, не виден весь текст, указанный в наименовании столбца;MPS;Констр. объекты;old;18
78143;Падение приложения при копировании маршрута через ВТМ документ (только у заказчика!);MPS;Маршруты;old;15
80521;"При импорте оборудования не заполняется в карточке свойств Оборудования на вкладке Цех/Группы ""Последнее движение""";MSV;Оборудование;new;1,4
79270;"При редактировании карточки простоя оборудования, не корректно отображается рассчитываемое поле ""Общее время""";MSV;Оборудование;new;21,2
80748;"[int] нестабильная работа отчета ""Входимость в пользовательские БО""";PMG;Бизнес-объекты;old;2,3
79997;[int] После завершения отложенного создания замен, блоки замен в спецификации не создаются;PMG;Констр. объекты;not available;0,5
79728;Не для всех КЭ создаются материалы и нормы расхода по картам разрешения ;PMG;Констр. объекты;not available;3,25
79530;Ошибка открытия КР;PMG;Мат. нормативы;new;15
78681;Проблема в костр составе с учетом экземпляров. Анализ проблемы у заказчика;PMG;Констр. объекты;zakazchik;2,5
80387;[int] PostgreSQL: не удается добавить год в производственный календарь;PMG_ADP_BIV_KYD_MPS;Базовые справочники;old;0,5
80220;"[int] Ошибка Oracle ORA-01747 при открытии задачи ""Выборка по всем изделиям""";PMG_ADP_BIV_KYD_MPS;Констр. объекты;new;0,5
80122;[int] Падение омеги при поиске пользователя через фильтр;PMG_ADP_BIV_KYD_MPS;Кадры;not available;0,9
80101;[int] Падение омеги при открытии экземпляров изделий;PMG_ADP_BIV_KYD_MPS;Констр. объекты;not available;0,1
80096;В типах объектов системы отображается неполный перечень СО;PMG_ADP_BIV_KYD_MPS;Объекты системы;not available;0,75
79004;[int] Ошибка PostgreSQL [42501] при попытке смены пароля;PMG_ADP_BIV_KYD_MPS;Бизнес-объекты;postgre;0
80235;Создание КР копированием ;PVA;Констр. объекты;postanovka;5,3
80125;[int] PostgreSQL: Ошибка PostgreSQL [P0002] - при задании признака условной единицы для валюты;PVA;Базовые справочники;postgre;1,65
80102;[int] Падение Омеги при открытии классификаторов;PVA;Классификаторы;not available;1,5
79932;Ошибка отображения строки сортировки в отчете ТП в присоединенной форме;PVA;Техпроцессы;new;24,75
80461;По КВ дает зарезервировать больше чем требуется ;REI;Складской учет;new;4,5
80433;Падение Омеги  при открытии списка КВ , а так же при работе с составом КВ;REI;Складской учет;new;10,5
80100;Падение Омеги ;REI;Складской учет;new;2,4
80582;При расчете производстенных мощностей, система повторно умножает трудоемкость по оборудованию на кол-во планируемых элементов.;SPS;Планирование заводское;new;2
80272;"Задача планировщика ""Удаление неактуальных тех.данных в ПП"" - не отображается индикация прогресса серверного задания";SPS;Планирование заводское;regressive;6
80175;"Модель планирования ""Заслон v.2"". Длительный расчет ПП ""test_PAV_20250930_aizp1""";SPS;Планирование заводское;new;3
79887;МЛ. Заказы МЛ по партиям. Не верное распределение кол-ва при расчете ПП с нестандартным подбором ТП;SPS;Учет в производстве;new;5
79292;"Модель планирования ""ОбКП Арсенал"". Раскрытие состава при расчете ПП, где планируемый элемент - спецификация-заказ";SPS;Планирование заводское;regressive;3,75
80212;Ошибка ORA-01747 при открытии производственных программ;SPS_KAD_KRA_MNE;Планирование заводское;not available;0
80179;[int] В карточке свойств цены не удается заполнить текстовые поля;SPS_KAD_KRA_MNE;Цены;not available;0,45
80236;Окно ошибки при закрытии окна ЖВК из учетной карточки.;SSB;Упр. качеством;refactoring;1,4
80222;"Не происходит добавление ""Распоряжение о передаче работ (РПР)""";SSB;Планирование заводское;not available;0
79833;Заполнение полей <Номер захода> и <Признак последнего захода> в ЦПГ 2.0;SSB;Планирование заводское;not available;24
78903;Отсутствуют предусмотренные ТЗ верификации на операциях ЖЦ АПС;SSB;Планирование заводское;postanovka;2,5
78886;АПС не контролирует комбинированные операции;SSB;Планирование заводское;postanovka;10
78881;Не работает ограничение прав по подразделению пользователя при работе с АПС;SSB;Планирование заводское;postanovka;1
78816;Не отображаются дроби в трудоемкости АПС;SSB;Планирование заводское;postanovka;0,5
