#;Тема;Назначена;Модуль;Категория ошибки;Трудозатраты
80109;Отсутствует возможность изменения значений атрибутов с типом Дата в карточке (не табличный вид) нормы расхода вспомогательного материала;SVA;Мат. нормативы;new;6,9
79082;Присоединенная форма плана;GIY;Планирование заводское;old;21,6
79028;"Ошибка создания БО ""Справка о затратах """;GIY;Нормативные затраты;new;3
78834;Ошибка добавления элементов с отрицательным количеством в Дополнение плана производства;GIY;Планирование заводское;old;17,85
80524;Исправить выгрузку остатков через апи;SAV;Складской учет;zakazchik;2,5
80239;Не зачитываются остатки с архивных карточек;SAV;Складской учет;zakazchik;43
79950;Не отображается номер объекта для атрибутов учета;SAV;Складской учет;new;2,5
79685;АИЗП. Ошибочное количество при отнесении партий;SAV;Складской учет;new;2
81411;Калькуляция. На базе заказчика не сохраняется калькуляция от РасчОб;KRA;Нормативные затраты;new;6
81378;"Не работает сортировка в отчете ""Контрактные спецификации комплектаций""";DMY;Констр. объекты;regressive;1
81375;[code64] Ошибка oracle при создании ревизии ТП;DMY;Техпроцессы;old;1,85
81344;При выключенном НС 435=0,  копируя ТП на КЭ автоматом проставляется номер по порядку и ошибка при копировании ТП на КЭ;DMY;Техпроцессы;new;4
81338;Не корректно работает сортировка по колонкам в извещениях на изменение, в извещениях на изменение маршрутов, в списке извещений на изменение материальных нормативов;MNS;Констр. объекты;new;4,2
81336;"Не работает сортировка в отчете ""Извещения на изменение""";DMY;Констр. ИИ;regressive;1,5
81333;"Не корректно читает csv  файл  , если в строке указана точка с запятой  "";"".";AVS;Складской учет;old;3
81306;[int] Падение при добавлении ссылки на ТТП;DMY;Техпроцессы;old;4,35
81291;Ошибка импорта Профессии через универсальный XML импорт;KAD;Базовые справочники;old;2,5
81289;"Калькуляция. Не отображается источник данных ""Расчет НЗ"". РасчОб. Удалить записи с кол-м =0 из содержимого РасчОб";KRA;Нормативные затраты;new;2,1
81287;"Не работает сортировка колонок в БО ""Заказы в производство""";MAR;Заказы;modification;8,83
81283;МЛ. Не заполняется Идентификатор строк ЗнП при расчете ПП с учетом МЛ;CHIG;Планирование цеховое;new;0,7
81282;[int] Ошибка изменения номера по порядку ТП для КЭ;DMY;Техпроцессы;old;2,2
81279;Ошибка при актуализации ПП с Дополнением;KAD;Планирование заводское;old;11
81269;Ошибки после тестирования заказчиком. Функционал ТЭП. Часть 2. Коэффициенты в содержимом калькуляции;KRA;Нормативные затраты;old;5,8
81255;Ошибка формирования БЫЛО/СТАЛО извещения на изменение маршрута для параллельных и множественных маршрутов;MNS;Маршруты;new;2,25
81245;Проблема при копировании КСО ЗЧМ;MNE;FOP/FOS;new;9
81243;"Просмотр объекта у пользователя без права ""Просмотр объекта""";PMG;Бизнес-объекты;not available;0,95
81231;Ошибки после тестирования заказчиком. Функционал ТЭП. Часть 1;KRA;Нормативные затраты;new;8,4
81227;[int] Ошибка PostgreSQL [42883] при открытии присоединенных файлов объекта;ADP;Бизнес-объекты;not available;1,1
81215;Настройки расчета ресурсов плана не сохраняются в задании планировщика;KRA;Планирование заводское;old;3
81210;"Ошибка ""Oracle ORA-01455"" при расчете производственной программы";KAD;Планирование заводское;new;1
81207;Сломали отображение прихода партий в карточках ;REI;Складской учет;not available;0
81205;Нет возможности импортировать ТП на статусе Аннул при выполнении импорта из ЭЖН;DMY;Техпроцессы;zakazchik;3,05
81196;Падение при расчёте ПП;KAD;Планирование заводское;new;2,3
81193;Зацикливания при выполнении автопереносов основных этапов в КСО АП;MNE;FOP/FOS;new;14,7
81171;Наряды. Расчет ЗП для работников с косвенно-сдельной оплатой труда ;CHIG;Учет в производстве;new;1,3
81170;[int] Ошибка обновления нормы расхода основного материала: Норма не может быть обновлена!;DMY;Мат. нормативы;support;1,3
81161;Ошибка наследования значения поля Номер ИМН норм расхода осн и вспом материала на КЭ при смене родительской ревизии КЭ;DMY;Мат. нормативы;support;0,5
81159;Дублировании записей при запуске импорт архива на PG. Отсутствие записей об инструкциях;ADP;Бизнес-объекты;not available;4,7
81157;Ошибка сохранения зависимости ТП от МО;DMY;Техпроцессы;old;3
81149;[int] Не сохраняется зависимость ТП;DMY;Техпроцессы;new;2,55
81146;Ошибка PostgreSQL [22004] при изменении/добавлении значения атрибута в отчет настройки содержимого;ADP;Бизнес-объекты;postgre;4,4
81127;[int] Устранение ошибки при открытии ПП без диаграммы Ганта;KAD;Планирование заводское;new;2
81120;Переименовать отчет Договоры\ Отчеты\ Сроки реализации внебиржевых сделок в Договоры\ Отчеты\ Сроки регистрации внебиржевых сделок;ASA;Договоры;postanovka;3
81115;"Изменение логики при построение отчета ""Изделия из""";MSV;Мат. нормативы;new;14,75
81114;Postgre. Некорректная работа форм для пользовательских БО, имеющих настройку содержимого;PMG;Бизнес-объекты;postgre;4,3
81111;Ошибка при копировании  технологических операций ;DMY;Техпроцессы;zakazchik;2,5
81101;Ошибка копирования исполнителя перехода при добавлении операции в редакторе ТП;DMY;Техпроцессы;old;3,4
81088;Ошибка установки значений атрибутов при импорте из PDM;MNE;Мат. нормативы;new;11,25
81084;[int] Падение при импорте нормы расхода осн. мат-ла через универсальный XML импорт;DMY;Мат. нормативы;new;1,3
81082;"Ошибка в работе ккм ""Добавить копированием от БО""";ADP;Бизнес-объекты;regressive;7,3
81080;Некорректно подтягивается норма расхода вспом. материала зависимая от заказа в потребность мат-лов;DMY;Мат. нормативы;zakazchik;1,3
81075;Ошибка ORA-00936: missing expression и падение при выборе цеха в фильтре отчета Нормы по цехам (вспом);DMY;Мат. нормативы;old;6,2
81067;При создании КР в качестве добавляемого и удаляемого элемента может быть выбран один и тот же элемент;ADP;Констр. объекты;zakazchik;1
81061;Ошибка импорта профессий рабочих;KAD;Кадры;new;5
81060;Падение Омеги при добавлении оборудования, мат-ла в дерево ТП;DMY;Техпроцессы;regressive;2,1
81059;[int] Ошибки на PG: Не удаляется тип БО созданный копированием. Некорректный перечень атрибутов от объекта;PMG;Бизнес-объекты;postgre;4,3
81057;[int] Ошибка PG при открытии содержимого ИИМ;MNE;Маршруты;support;7
81050;[int] Затирается наименование операции при изменении номера и свойств;DMY;Техпроцессы;new;0,2
81040;Некорректно работает сортировка БО в гридах;DMY;Техпроцессы;regressive;4,7
81039;[int] Падение системы при закрытии окна Содержимое проекта с помощью тестировщика;AVS;Планирование проектное;new;3,6
81037;Ошибка PostgreSQL [42703] при добавлении типа БО копированием ;ADP;Бизнес-объекты;regressive;8,9
81028;Корректировка импорта инструкции и карт эскиза ;ADP;Бизнес-объекты;new;2
81017;Ошибка DLL - OmTechProcUI.dll при открытии от инструкции входимость в ТП ;ADP;Техпроцессы;refactoring;2,6
81008;Падение при добавлении оснастки на операцию ТП перетягиванием через Drag&Drop из справочника Вся оснастка в дерево ТП;DMY;Техпроцессы;old;1,55
81007;Ошибка Oracle ORA-01407 при создании ВЗН;AVS;Учет в производстве;old;3,3
80990;Ошибка сохранения сортировки на закладке детали типового ТП;DMY;Техпроцессы;old;5
80969;Исчезает текст перехода при редактировании;DMY;Техпроцессы;old;3,25
80955;[int] Ошибка постгре в выборке по всем изделиям ;ADP;Констр. объекты;not available;1,5
80946;[int] Некорректный расчет стоимости операции в ПП;DMY;Планирование заводское;new;6,65
80944;"Слетает вид операции Внешний ТП на ""пусто"" в редакторе ТП при обновлении из классификатора тех. операций";DMY;Техпроцессы;regressive;4,25
80942;Пропала возможность добавления копированием настраиваемого содержимого ;ADP;Бизнес-объекты;new;3,9
80937;При импорте содержимого документов в результатах на одну ошибку больше, чем отображается в протоколе ;ADP;Бизнес-объекты;new;2,1
80934;Падение приложения при выборе маршрута в содержимом ВТМ документ;DMY;Маршруты;regressive;2
80913;[int] Некорректное описание прав пользователей на ЖЦ БО на PG;ADP;Бизнес-объекты;old;1,5
80899;"[int] В отчетах ""Нормы по списку изделий из данного материала..."" отображаются неутвержденные нормы";MNS;Мат. нормативы;new;4,85
80895;У заказчика перестали формироваться наименования операций ТП по правилу;DMY;Техпроцессы;regressive;2,5
80891;Ошибка при  импорте нормы основного материала;MNS;Мат. нормативы;new;4,3
80871;"Ошибка в отчете ""Операции технологического процесса"" в режиме редактирования зависимости операций от пунктов МО";DMY;Техпроцессы;new;3,05
80863;Нет возможности добавить операцию технологического процесса;MNS;Техпроцессы;new;0,2
80862;Падение системы при раскрытии перехода Установа в дереве ТП;DMY;Техпроцессы;old;0,7
80861;Падение при запуске Импорт/Экспорт\ Импорт архива документов из Windchill;ADP;Бизнес-объекты;modification;14,9
80846;[int] Ошибка при открытии отчетов по графикам разработки ТП от ВТМ;MNE;Маршруты;new;2,7
80840;Спецификация договора. Мелкие ошибки в документе;ASA;Договоры;old;10
80831;При ограничении прав на просмотр присоединенных  файлов, это ограничение не проверяется в форме Присоединенные файлы в Почте;ADP;Констр. объекты;old;6
80828;Некорректно работает сортировка в гридах;ADP;Бизнес-объекты;refactoring;5,5
80821;[int] В списке материалов спецификации не отображаются нормы ТП с ссылкой на ТТП;DMY;Мат. нормативы;regressive;3,95
80817;[int] Сломались вкладки окна Свойства ПП;SPS_KAD_KRA_MNE;Планирование заводское;not available;0,3
80805;Не работают расчеты загрузки в ЗЛ и ЗЧМ если привязана панель производства на автокомпоненты (MTC);MNE;FOP/FOS;new;6
80778;[int] Падение при при вызове контекстного меню от перехода в содержимом Установа;DMY;Техпроцессы;new;1,9
80776;"Потоки работ 1.0. Падение при открытии печатной формы из присоединенного окна ""Бизнес-объекты""";AVI;Потоки работ;new;4,8
80747;Производственная программа - не сохраняется Стоимость по исполнителю для производственной работы партии;DMY;Планирование заводское;new;31,25
80722;Отсутствует закладка с комплектовочной картой на переходах в редакторе ТП;DMY;Техпроцессы;old;2,7
80715;"Проблема изменения привязки технологического маршрута и места изготовления в ""Omega Production"" через XML-импорт";DMY;Маршруты;old;3
80596;Ошибка при отмене создания ревизии ;SVA;Финансы;new;2,5
80522;[int] Задвоение норм в отчете Изделия из данного материала;DMY;Мат. нормативы;modification;11,1
80510;Исправить поиск номенклатуры в импорте КВ;REI;Складской учет;new;1,9
80487;"Некорректная работа опции ""Значение всегда зафиксировано"" частично-вычислимого атрибута";DMY;Техпроцессы;support;3,5
80470;Ожидания при выполнении select create_omp_tmp_tables(), блокировки LWLock: BufferMapping, Lock: tuple;BEA;FOP/FOS;modification;25,8
80453;Ошибка подбора партий при комплектовании по КВ ;REI;Складской учет;new;10
80404;[int] Неправильное определение типа варианта;MNE;FOP/FOS;new;20
80338;Ошибка группового редактирования атрибутов с типом дата  ;SSB;Упр. качеством;new;2,5
80328;Расчет фактического отпуска номенклатуры на заказ. Взаимозаменяемые элементы не сгруппированы;SSB;Снабжение;not available;4
80274;[int] PostgreSQL: Ошибка PostgreSQL [23502] - при обновлении работника без отчества;ADP;Базовые справочники;postgre;2,4
80226;[int] PostgreSQL: Ошибка PostgreSQL [42703] - при удалении цены;SPS_KAD_KRA_MNE;Цены;not available;0,4
80167;Не работает групповое редактирование  в электронном паспорте изделия;AVS;Упр. качеством;not available;0,5
80166;Вкладка Состав серийного объекта.Номер экземпляра не отображается, хотя в спецификации заказ указан тип основной ;AVS;Упр. качеством;code64;3,5
80140;"Слетает сортировка, после внесения изменений. Справочник ""Единицы измерения""";PVA;Базовые справочники;modification;3
80110;[int] Некорректное отображение данных сборочного материала в таблице содержимого спецификации;PMG;Констр. объекты;not available;0,45
79979;[int] Не корректная сортировка отчета Учет простоев оборудования по дате начала;MSV;Оборудование;old;5,7
79845;[int] Ошибка Oracle ORA-01854 - выходит один раз и пропадает;SVA;Планирование заводское;regressive;10,7
79746;[int] Некорректный расчет стоимости операции МЛ по формуле;AVS_SAV_CHIG_SSB_REI_ASA;Учет в производстве;support;6,3
79742;Ошибка открытия БО от работы в списке моих работ;MSV;Оборудование;new;4,3
79738;Некорректные коэффициенты пересчета для цены и подсчет стоимости в отчете по фактическому отпуску номенклатуры на заказ;SSB;Снабжение;old;7,8
78874;График загрузки единиц оборудования от ПП - множество ошибок;SPS;Планирование заводское;regressive;15,25
78289;"[int] Не полное отображение истории изменения маршрута по ккм ""История технологических изменений/технологических маршрутов""";MNS;Маршруты;modification;5,5
78267;Падение Омеги при редактировании св-в задачи в списке общих проектов;GIY;Планирование проектное;not available;7,5
82082;Импорты МЭТЗ из Imbase игнорируют проверку уникальности БО;PVA;Констр. объекты;new;5
82073;Исправление падения при импорте;ADP;Бизнес-объекты;new;1,5
82071;[int] В xml-структуру выгрузки ТП попадают данные об основном материале и  нормах расхода основного материала;DMY;Техпроцессы;support;1
82036;[int] При установке активности ТП с ТКУ устанавливается связь ТП с ТКУ.;DMY_GIY_BEA_MNS_MSV;Техпроцессы;support;1
82012;[int] Ошибка установки активности сквозного ТП при добавления ТП копированием;DMY;Техпроцессы;regressive;2,2
82008;Ошибка PostgreSQL [42601] при изменении номенклатуры складской карточки;AVI;Складской учет;postgre;5
82001;[int] Ошибка копирования КЭ с техпроцессом;DMY;Техпроцессы;old;2,9
81999;"Калькуляция. При формировании от РасчОб значения статей ""На единицу"" = 0";KRA;Нормативные затраты;new;1,2
81968;Справочник ТЭР. Изменить подпись окна Истории изменения;KRA;Нормативные затраты;old;0
81936;PostgreSQL: Ошибка PostgreSQL [42703] - при создании складской карточки;AVI;Складской учет;postgre;4
81930;[int] Копирование трудовых нормативов на ревизию КЭ при отключенном НС 212;DMY;Трудовые нормативы;support;2,25
81924;Невозможно удалить МЛ у которых не заданы серийные номера ;CHIG;Учет в производстве;new;1
81923;"Ошибка при удалении объектов со статусом ""Проект.""";DMY;Маршруты;old;5,5
81910;Ошибка выгрузки данных по вспомогательным нормам в 1С:управление кооперацией;CHIG;Разное;new;2,5
81901;Нормативные затраты. Некорректно зачитываются данные по Месту изготовления при запуске расчета из Списка объектов;KRA;Нормативные затраты;new;1
81896;[int] Падение системы при перенумерации операции в редакторе ТП;DMY;Техпроцессы;regressive;1,9
81859;Не снимается блокировка с КСО ЗЛ/ЗЧМ;MNE;FOP/FOS;new;0,5
81855;Ошибка ора при попытки создания втм ;KPA;Маршруты;postgre;1
81850;"В Отчет ""Трудоемкость и стотиомсть операций.. попадают не все операции ТП";DMY;Техпроцессы;old;6,4
81847;"Потоки работ 2.0. Отсутствует команда на запуск потока от объекта типа ""Комплектовочная ведомость""";BIV;Потоки работ;old;4,5
81841;Падает омега при импорте работника ;SAV;Базовые справочники;new;1,5
81831;[int] Ошибка при утверждении КСО А/П/БС;MNE;FOP/FOS;new;3,95
81823;Не рассчитывается стоимость операции;DMY;Техпроцессы;modification;2,95
81821;Падение Омеги на версии Weekly при формировании отчета по ВТТ\неВТТ от содержимого калькуляции;KRA;Нормативные затраты;new;2,2
81795;Синхронизация заказа не учитывает изменения количества при копировании сущности «Дополнение»;KAD;Планирование заводское;new;8
81789;"[int] В отчетах ""Изделия из"" без учета применяемости отображаются КЭ с неутвержденными и аннулированными нормами";DMY;Мат. нормативы;support;4,3
81788;Ошибка в логе при конвертации иллюстраций;MNS;Техпроцессы;new;0,6
81783;[int] Не отображается значение атрибута-ссылки на предприятие в атрибуте;ADP;Бизнес-объекты;not available;1,3
81782;Ошибки печати комплектовочной карты - не выводится обозначение Стандартного изделия;DMY;Техпроцессы;old;7,4
81753;Не отображаются данные в колонках, добавленных черех редактор колонок;MAR;Базовые справочники;modification;4,5
